{"schema":1,"pack":{"id":"sample-learning-ch1","version":1,"created":"2026-10-25"},"book":{"id":"sample-learning","title":"Sample: How to Learn","authors":["Learn app"],"publisher":"Learn app sample content","license":"CC BY 4.0","licenseUrl":"https://creativecommons.org/licenses/by/4.0/","attribution":"Sample text written for this app."},"chapter":{"id":"ch1","number":1,"title":"1. Learning that sticks","order":1,"sections":[{"id":"s1.1","title":"1.1 Why spacing works","order":1,"html":"<p>Memories fade quickly after we first learn something. Each time we successfully recall an idea, the memory becomes more stable and fades more slowly. <strong>Spaced repetition</strong> uses this: it schedules each review just before you would forget.</p><h3>Recall beats rereading</h3><p>Actively retrieving an answer strengthens memory far more than rereading the same page. That is why every section in this app ends with questions.</p><blockquote><p><strong>Try it</strong></p><p>Close your eyes and summarise this paragraph in one sentence.</p></blockquote>","summary":"Recall strengthens memories, and spacing reviews just before forgetting makes them last longer.","keyTerms":[{"term":"spaced repetition","definition":"reviewing material at increasing intervals, timed just before forgetting"},{"term":"retrieval practice","definition":"actively recalling information instead of rereading it"}],"items":[{"id":"q1","type":"mcq","prompt":"What does spaced repetition schedule?","options":["Each review just before you would forget","All reviews on the same day","Reviews only after mistakes","Rereading instead of recall"],"answer":0,"explanation":"Spaced repetition times each review just before the memory would fade."},{"id":"q2","type":"mcq","prompt":"Which strengthens memory more?","options":["Rereading the page","Actively recalling the answer","Highlighting key words","Reading faster"],"answer":1,"explanation":"Retrieval (actively recalling) strengthens memory far more than rereading."},{"id":"e1","type":"explain","prompt":"Explain in your own words why recall beats rereading.","rubric":["memories fade","retrieval strengthens memory","rereading is passive"]}]},{"id":"s1.2","title":"1.2 The box ladder","order":2,"html":"<p>This app sorts every question into one of seven <strong>boxes</strong>. A new question starts in box 0 and is due immediately. A correct answer moves it up one box; a wrong answer sends it back to box 1.</p><figure><img src=\"media/intervals.webp\" alt=\"Bar chart: box 0 is due after 0 days, box 1 after 1, box 2 after 3, box 3 after 7, box 4 after 16, box 5 after 35, box 6 after 90 days.\" width=\"600\" height=\"300\"><figcaption><strong>Figure 1.2.1</strong> Days until the next review, per box.</figcaption></figure><table><caption>Results</caption><thead><tr><th>Score</th><th>Effect</th></tr></thead><tbody><tr><td>2–3</td><td>up one box</td></tr><tr><td>1</td><td>down one box (min. 1)</td></tr><tr><td>0</td><td>back to box 1, counts a lapse</td></tr></tbody></table>","summary":"Seven boxes with growing intervals; correct answers move up, wrong answers reset to box 1.","keyTerms":[{"term":"lapse","definition":"a forgotten item that falls back to box 1"}],"items":[{"id":"q1","type":"mcq","prompt":"Where does a new question start?","options":["Box 0, due immediately","Box 1, due tomorrow","Box 6, due in 90 days","In no box until answered twice"],"answer":0,"explanation":"New questions start in box 0, which has an interval of 0 days."},{"id":"q2","type":"mcq","prompt":"What happens after a wrong answer?","options":["The question moves up one box","The question goes back to box 1","The question is deleted","Nothing changes"],"answer":1,"explanation":"A wrong answer (score 0) resets the question to box 1 and counts a lapse."},{"id":"q3","type":"mcq","prompt":"How many days until the next review for a question in box 3?","options":["3","7","16","35"],"answer":1,"explanation":"The intervals are 0, 1, 3, 7, 16, 35, 90 days for boxes 0–6, so box 3 waits 7 days."}]}]},"media":{"media/intervals.webp":"data:image/webp;base64,UklGRvwJAABXRUJQVlA4IPAJAABQWQCdASpYAiwBPm02mkkkIyKhIbHI+IANiWlu4XXl7mFXjJszlY6AOhLDV/gb+V/jr4Sfz/wb7xfprM0fF+nv8P4tf0f8nfOfgBep/7xvBNTv9B6gXp98u/3329+dJ+Z/Zx8Ad6f+Q/6vzx/mfikfIvUA/ln8+/wH9q/cH/ffSZ+yf8H+keaP80/tH/i/zXwEfyn+c/9L+2+1x7KvRP/V7//h881O7DWpOTuhrUnJ3Q1qTk7oa1Jyd0Nak5O6GtScndClZQS9/EDRw7rBWGjqTk7oa1Jyd0Nak5O6FSzkDpKdEzrLCGjqTk7oa1Jyd0Nak5O52bijmpLhpZXdDWpOTuhrUnJ3Q05adwdpGvAD1Syu6GtScndDWpORkOIc1JcNLK7oa1Jyd0Nak5O6GnLTuDtI14AeqWV3Q1qTk7oa1JyMhxDmpLhpZXdDWpOTuhrUnJ3Q05adwdpGvAD1Syu6GtScndDWXgrrDCa3PseGlld0Nak5O6GtScigISyC1S5K1EF/7JaZvYIj9kAOa8/pWGjqTk7oa1Jyd0NZodp+wJ8yAxFt8APVLK7oa1JydzuS0rp29/ibHMBzC7dtotd0Nak5O6GtSciHqh6DvjNEkhuRL6kL8/brJazJIjRUsruhrUm4axx52OhQO1RmwbOeEKgxaolq2f0X/bvBhFYTW59jwzSyPPHOC0pe8oqfulvzjIkV1/op9iGa5ArhMFUfX1ckoEJjMcshxDizu8GEVhNbn2PCSQJz84Ip4+j5gxd6OSHEG3chw7zWQoKoHPp1kr9h3uyk4BjA+czR9tBzMIpdrwlGDBWEs95rIhxRCWutcUTYDDs/X8oqtf1Cd5rspvJju3mf6a8j5L4FryydS0GUdC6SEE1W02ZtMAIIwyrbB3rP49Py7NS6VEUoV5qwjwIzJ3H0AZA7ohz7TEoTk5O6GtScndDWpOTuhrUnJ3Q1lgAA/v+b3AwS6iSzK8EAQEIAwz4+NbhHsJDAW82VEP26m7bq9IptX3pGDkVZ/47NtLEbYwqZwKxHN7hWR2oEPIc8mG7Gdhnwcc+pNx4j7dtI8cfbJV1SGc3Q4RqOMoBfs3N7cdidUrTXKASkOo1M45sbG6tqwrHFnBx8SODka3rgQp1oACG44o97njXF1r9r9UXU2d38m5+CoShaAjWAIKXhHHRkxZAudm4IE2izNoAEpeADtoMQA/MSEAT0WBAHBQYgB+YkIBB88OqVrqZAnK2bJINfh9IvdF69S/dBzgVss5q3M550tImFumzoeBsZeI2mgxALkQn1d8Y3C7JCZdmPqXNsfRCoaCOcfpVr8A5zgAwyqw87lQkBEcRn+A/psBzcPLdItZuPbLhxbMazyrqATbRr/iN82nM8/0abeHFWEhFeuB5NusiNkX4sWXZXVVZZjgy0wpJpU7QFYDwR/yJR4g3pASJ7VQiwICpFW8IfOlFgQLd7v9epJOz3ny0PVXyLspfjOGKrmPklx6X91ADxQMeFC3dDXVSjiKhEn1tjOr94NnQzsqhstJ6i8XRVFSqTe0JOtTzxPrEhAebbJMqMwSepDn/QK3/IRjvfm++0BEmsD/GUwKwnUpQQmpqM0wUULhu6bpR9zTB4pVtv8UTKD55nmLq5UH5ofWBr40WBPFJiqG22oBE9WWP3eTvyompyiPZVrBiDtNfov9nv+1ujwUeX5vhEUsKcu7GJtiGUQPRdv4y4V5dr32LmDqNUyKxriyJpkalmSreH8AyFGeAojDyQ0leJVzRWtaKpL46Sh1RBDcQ5+WTkpBVTSW/dWYmm+NRgR9lvWQqyVKvmQLVK3L6zkA8X4hoUXh6YY0CasvOsiV3JyO8HNySqsaE0Gpq+VORTnnRn/ye3x4HaZhntgdX5tDHuGV0qIJT8R698+B4TdKvXJI/CzDex7WBDPMADt0HRS/bdmjQnWDN2aKkP+K7Q8cWUJI+MRzV8wQry1aPwrnefBf6INL5i9O5KbAgjTk6ur3s6Q/YnRPlJ8sHiSQu4zxdsmY4MjwtLax1i6shd4UNqvoRIEK0KJF9u3/0bJdlShbQPmrxGhgGmqEHTsRAXF3TLxe1JXD9eqdwVO6/1nyk4lnQlaRBUPbBbYQadBncQqLz6jVe2p2yZ0ZkDPjBqD3RLSfzImv+htHgDYjzfDlaMPaorM5uazRXkq2hkkkL36xOCRsFzEZ6zNKoLPh3G3WJO/SRda/59HEskeq+qek8hknJwboEAaNoI5DJk59wr1Lidu3i++ILlsqY9OtW+rt56wVFfrI68tJI1/VzVmV8r7PQRRFauGBiGdXDqn4xd2ONxVS80Dp69LICAz81Cv3xlpqQjLKmwcldI5cjjENT02sFc+egRtz453fcDTPBIqX/EvzCqkF/3fX178bmhQT5p6nVpb50m9uaFz0M3n1jhr0qbVvqu8tV1q+mef3CvQbxnFtxWZ2Alvg9pSdfWCZGMouUkEAFZ4ZXJ6wZtgX7qj+Y5N3Pfr19wuSgP03PfeZ0jlFnmdix+N9oFwX+uGtOTBnwF5tlUCU7Paef0jCyth6Ra6ngaxglVygIo8BHQh4Bc3Ta0v0HaKy7vfzIfzqZ539W8a64iq/lDppaAMJLmI9aVUfwMU5cb1XaCtlf6BUQQhpecyUtzUw3zN5CcPIlIubrFDG0IzJ0to8fGU0K9YivhiB/DhhvB6Mw5lFyu+OL0kh7/FtpiFBKl7HCFUevBnXpIkxInyx+1EWSbFnM2UX2FawStq8DsF5/vNAzfOBDAxzXqu4KhzqyuW0AYZoYmmt1N/yjKbl2mEx2iks/5o/s+8VCFywdRGJPiNXz4QkVVIcty/BwzMa3Ohc8YmwGlJBDYMurNmnYUB869JwVeFILk9QB8mSWZ44uZtJQv2nLiUi5usT+tkRYf2IreUl+LbSZplTOcAumnztHqYSfhww3g9GYcyi5XfJaAcf4tWwQxm4hMv1OvJZgLLLHjWhLvp6wNIZdfdk7lTjqoDUzDYJ/Mq/RTc8V04DwT/gItnLXf3R+BdDOlYJWuwWSXm/8YPCFzQw3R7jcVmRtrAVyUyL52mRKrQVFMX1tvhG4HWBBn2KdM2WZ1nHASYUVH+JXdhKQjr+Nh64p1nLRGQaOhS6qgvd7bzXWFgsSYHWftINYE3gONKyuXtxjm74qeMXmSINdHe3i20macaGDPfExiUQMrT2+HDDeD0ZhzKLld8h8AAzyDNNJtpY8N6nB32ZphqMPFz1KViWIxOqcDUvTFUYkkQ1z2MFOxY/G+0C4L4kCnPU0xe6PQKYbn8xKkuzV80q9J87I3PpS2yfczjjY5uP1975lKCDCI7ZJGFkN1C4U32mX8JprjnzJqCNYbyMjFDv0MOlxt/KLMMRi8FSQ70KkKgAAAAAA="}}